{
  "kind": "evaluation",
  "evaluates": [
    "srlrwowp"
  ],
  "depends_on": [
    "kzqwqptv",
    "twtvwkqm",
    "vpqxkzxq"
  ],
  "content": {
    "type": "test",
    "ref": [
      "tests/integration/srlrwowp-conformance.test.ts"
    ],
    "rationale": "structured requirements with a runnable artifact dependent: conformance is what running the artifact shows, so the gate states the observables the requirements demand and leaves the verdict to the run"
  }
}
