{
  "kind": "evaluation",
  "evaluates": [
    "usunynqx"
  ],
  "depends_on": [
    "xtsnpqmr"
  ],
  "content": {
    "type": "review-criteria",
    "ref": "inline",
    "content": "no element of usunynqx contradicts xtsnpqmr; fail on any contradicting element, naming the element",
    "rationale": "a requirement-sentence elaboration of prose buys no license to demand observables; the gate keeps the elaboration honest to its prose parent"
  }
}
