{
  "kind": "evaluation",
  "evaluates": [
    "yxnoktrx"
  ],
  "depends_on": [
    "srlrwowp"
  ],
  "content": {
    "type": "test",
    "ref": [
      "tests/integration/yxnoktrx.test.ts"
    ],
    "rationale": "both ends are executable: the dependent artifact must honor the prerequisite's contract, and that is a machine verdict, so the check runs the two artifacts against each other"
  }
}
