{
  "kind": "evaluation",
  "evaluates": [
    "sszrrpwn"
  ],
  "depends_on": [
    "vlvmrkzr"
  ],
  "content": {
    "type": "review-criteria",
    "ref": "inline",
    "content": "no element of sszrrpwn contradicts vlvmrkzr; fail on any contradicting element, naming the element",
    "rationale": "no eval-matrix cell covers a structured or code parent used by a structured or natural child; the default cell is the gate form, flagged to extend the matrix"
  }
}
