{
  "kind": "evaluation",
  "evaluates": [
    "zkvxornu"
  ],
  "depends_on": [
    "mmsmukkk"
  ],
  "content": {
    "type": "review-criteria",
    "ref": "inline",
    "content": "no element of zkvxornu contradicts mmsmukkk; fail on any contradicting element, naming the element",
    "rationale": "prose dependent on a prose prerequisite: the use is sound exactly when it introduces no contradiction, so non-violation is the whole gate"
  }
}
