{
  "kind": "evaluation",
  "evaluates": [
    "xrxmwrxz"
  ],
  "depends_on": [
    "tqxvykwn"
  ],
  "content": {
    "type": "review-criteria",
    "ref": "inline",
    "content": "no element of xrxmwrxz contradicts tqxvykwn; fail on any contradicting element, naming the element",
    "rationale": "no eval-matrix cell covers a structured or code parent used by a structured or natural child; the default cell is the gate form, flagged to extend the matrix"
  }
}
